
         /\      Grafana   /‾‾/  
    /\  /  \     |\  __   /  /   
   /  \/    \    | |/ /  /   ‾‾\ 
  /          \   |   (  |  (‾)  |
 / __________ \  |_|\_\  \_____/ 

     execution: local
        script: C:\Users\Administrator\Desktop\days\test\k6\redirect_test.js
        output: -

     scenarios: (100.00%) 1 scenario, 50 max VUs, 1m30s max duration (incl. graceful stop):
              * constant_load: 50 looping VUs for 1m0s (gracefulStop: 30s)

time="2026-01-17T12:40:01+08:00" level=info msg="预创建 20 个短链" source=console

running (0m01.0s), 50/50 VUs, 5126 complete and 0 interrupted iterations
constant_load   [   1% ] 50 VUs  0m00.9s/1m0s

running (0m02.0s), 50/50 VUs, 11791 complete and 0 interrupted iterations
constant_load   [   3% ] 50 VUs  0m01.9s/1m0s

running (0m03.0s), 50/50 VUs, 18320 complete and 0 interrupted iterations
constant_load   [   5% ] 50 VUs  0m02.9s/1m0s

running (0m04.0s), 50/50 VUs, 25614 complete and 0 interrupted iterations
constant_load   [   6% ] 50 VUs  0m03.9s/1m0s

running (0m05.0s), 50/50 VUs, 32304 complete and 0 interrupted iterations
constant_load   [   8% ] 50 VUs  0m04.9s/1m0s

running (0m06.0s), 50/50 VUs, 39182 complete and 0 interrupted iterations
constant_load   [  10% ] 50 VUs  0m05.9s/1m0s

running (0m07.0s), 50/50 VUs, 45922 complete and 0 interrupted iterations
constant_load   [  11% ] 50 VUs  0m06.9s/1m0s

running (0m08.0s), 50/50 VUs, 52610 complete and 0 interrupted iterations
constant_load   [  13% ] 50 VUs  0m07.9s/1m0s

running (0m09.0s), 50/50 VUs, 59466 complete and 0 interrupted iterations
constant_load   [  15% ] 50 VUs  0m08.9s/1m0s

running (0m10.0s), 50/50 VUs, 66085 complete and 0 interrupted iterations
constant_load   [  16% ] 50 VUs  0m09.9s/1m0s

running (0m11.0s), 50/50 VUs, 73366 complete and 0 interrupted iterations
constant_load   [  18% ] 50 VUs  0m10.9s/1m0s

running (0m12.0s), 50/50 VUs, 80591 complete and 0 interrupted iterations
constant_load   [  20% ] 50 VUs  0m11.9s/1m0s

running (0m13.0s), 50/50 VUs, 87010 complete and 0 interrupted iterations
constant_load   [  21% ] 50 VUs  0m12.9s/1m0s

running (0m14.0s), 50/50 VUs, 94342 complete and 0 interrupted iterations
constant_load   [  23% ] 50 VUs  0m13.9s/1m0s

running (0m15.0s), 50/50 VUs, 102340 complete and 0 interrupted iterations
constant_load   [  25% ] 50 VUs  0m14.9s/1m0s

running (0m16.0s), 50/50 VUs, 109926 complete and 0 interrupted iterations
constant_load   [  26% ] 50 VUs  0m15.9s/1m0s

running (0m17.0s), 50/50 VUs, 117250 complete and 0 interrupted iterations
constant_load   [  28% ] 50 VUs  0m16.9s/1m0s

running (0m18.0s), 50/50 VUs, 124468 complete and 0 interrupted iterations
constant_load   [  30% ] 50 VUs  0m17.9s/1m0s

running (0m19.0s), 50/50 VUs, 132093 complete and 0 interrupted iterations
constant_load   [  31% ] 50 VUs  0m18.9s/1m0s

running (0m20.0s), 50/50 VUs, 139270 complete and 0 interrupted iterations
constant_load   [  33% ] 50 VUs  0m19.9s/1m0s

running (0m21.0s), 50/50 VUs, 145964 complete and 0 interrupted iterations
constant_load   [  35% ] 50 VUs  0m20.9s/1m0s

running (0m22.0s), 50/50 VUs, 152147 complete and 0 interrupted iterations
constant_load   [  36% ] 50 VUs  0m21.9s/1m0s

running (0m23.0s), 50/50 VUs, 158392 complete and 0 interrupted iterations
constant_load   [  38% ] 50 VUs  0m22.9s/1m0s

running (0m24.0s), 50/50 VUs, 165658 complete and 0 interrupted iterations
constant_load   [  40% ] 50 VUs  0m23.9s/1m0s

running (0m25.0s), 50/50 VUs, 172661 complete and 0 interrupted iterations
constant_load   [  41% ] 50 VUs  0m24.9s/1m0s

running (0m26.0s), 50/50 VUs, 180221 complete and 0 interrupted iterations
constant_load   [  43% ] 50 VUs  0m25.9s/1m0s

running (0m27.0s), 50/50 VUs, 187701 complete and 0 interrupted iterations
constant_load   [  45% ] 50 VUs  0m26.9s/1m0s

running (0m28.0s), 50/50 VUs, 195185 complete and 0 interrupted iterations
constant_load   [  46% ] 50 VUs  0m27.9s/1m0s

running (0m29.0s), 50/50 VUs, 202314 complete and 0 interrupted iterations
constant_load   [  48% ] 50 VUs  0m28.9s/1m0s

running (0m30.0s), 50/50 VUs, 208920 complete and 0 interrupted iterations
constant_load   [  50% ] 50 VUs  0m29.9s/1m0s

running (0m31.0s), 50/50 VUs, 215135 complete and 0 interrupted iterations
constant_load   [  51% ] 50 VUs  0m30.9s/1m0s

running (0m32.0s), 50/50 VUs, 220937 complete and 0 interrupted iterations
constant_load   [  53% ] 50 VUs  0m31.9s/1m0s

running (0m33.0s), 50/50 VUs, 227561 complete and 0 interrupted iterations
constant_load   [  55% ] 50 VUs  0m32.9s/1m0s

running (0m34.0s), 50/50 VUs, 233954 complete and 0 interrupted iterations
constant_load   [  56% ] 50 VUs  0m33.9s/1m0s

running (0m35.0s), 50/50 VUs, 239144 complete and 0 interrupted iterations
constant_load   [  58% ] 50 VUs  0m34.9s/1m0s

running (0m36.0s), 50/50 VUs, 246315 complete and 0 interrupted iterations
constant_load   [  60% ] 50 VUs  0m35.9s/1m0s

running (0m37.0s), 50/50 VUs, 253807 complete and 0 interrupted iterations
constant_load   [  61% ] 50 VUs  0m36.9s/1m0s

running (0m38.0s), 50/50 VUs, 261088 complete and 0 interrupted iterations
constant_load   [  63% ] 50 VUs  0m37.9s/1m0s

running (0m39.0s), 50/50 VUs, 268482 complete and 0 interrupted iterations
constant_load   [  65% ] 50 VUs  0m38.9s/1m0s

running (0m40.0s), 50/50 VUs, 275138 complete and 0 interrupted iterations
constant_load   [  66% ] 50 VUs  0m39.9s/1m0s

running (0m41.0s), 50/50 VUs, 282078 complete and 0 interrupted iterations
constant_load   [  68% ] 50 VUs  0m40.9s/1m0s

running (0m42.0s), 50/50 VUs, 289094 complete and 0 interrupted iterations
constant_load   [  70% ] 50 VUs  0m41.9s/1m0s

running (0m43.0s), 50/50 VUs, 294937 complete and 0 interrupted iterations
constant_load   [  71% ] 50 VUs  0m42.9s/1m0s

running (0m44.0s), 50/50 VUs, 302049 complete and 0 interrupted iterations
constant_load   [  73% ] 50 VUs  0m43.9s/1m0s

running (0m45.0s), 50/50 VUs, 308795 complete and 0 interrupted iterations
constant_load   [  75% ] 50 VUs  0m44.9s/1m0s

running (0m46.0s), 50/50 VUs, 314302 complete and 0 interrupted iterations
constant_load   [  76% ] 50 VUs  0m45.9s/1m0s

running (0m47.0s), 50/50 VUs, 321444 complete and 0 interrupted iterations
constant_load   [  78% ] 50 VUs  0m46.9s/1m0s

running (0m48.0s), 50/50 VUs, 328851 complete and 0 interrupted iterations
constant_load   [  80% ] 50 VUs  0m47.9s/1m0s

running (0m49.0s), 50/50 VUs, 336177 complete and 0 interrupted iterations
constant_load   [  81% ] 50 VUs  0m48.9s/1m0s

running (0m50.0s), 50/50 VUs, 343202 complete and 0 interrupted iterations
constant_load   [  83% ] 50 VUs  0m49.9s/1m0s

running (0m51.0s), 50/50 VUs, 348655 complete and 0 interrupted iterations
constant_load   [  85% ] 50 VUs  0m50.9s/1m0s

running (0m52.0s), 50/50 VUs, 356182 complete and 0 interrupted iterations
constant_load   [  86% ] 50 VUs  0m51.9s/1m0s

running (0m53.0s), 50/50 VUs, 362769 complete and 0 interrupted iterations
constant_load   [  88% ] 50 VUs  0m52.9s/1m0s

running (0m54.0s), 50/50 VUs, 368192 complete and 0 interrupted iterations
constant_load   [  90% ] 50 VUs  0m53.9s/1m0s

running (0m55.0s), 50/50 VUs, 374709 complete and 0 interrupted iterations
constant_load   [  91% ] 50 VUs  0m54.9s/1m0s

running (0m56.0s), 50/50 VUs, 381203 complete and 0 interrupted iterations
constant_load   [  93% ] 50 VUs  0m55.9s/1m0s

running (0m57.0s), 50/50 VUs, 387056 complete and 0 interrupted iterations
constant_load   [  95% ] 50 VUs  0m56.9s/1m0s

running (0m58.0s), 50/50 VUs, 392198 complete and 0 interrupted iterations
constant_load   [  96% ] 50 VUs  0m57.9s/1m0s

running (0m59.0s), 50/50 VUs, 397427 complete and 0 interrupted iterations
constant_load   [  98% ] 50 VUs  0m58.9s/1m0s

running (1m00.0s), 50/50 VUs, 401700 complete and 0 interrupted iterations
constant_load   [ 100% ] 50 VUs  0m59.9s/1m0s
time="2026-01-17T12:41:01+08:00" level=info msg="跳转性能测试完成" source=console


  █ THRESHOLDS 

    errors
    ✓ 'rate<0.01' rate=0.00%

    http_req_duration
    ✓ 'p(50)<50' p(50)=6.64ms
    ✓ 'p(95)<200' p(95)=12.58ms
    ✓ 'p(99)<500' p(99)=18.98ms


  █ TOTAL RESULTS 

    checks_total.......: 1206783 20066.064774/s
    checks_succeeded...: 99.99%  1206782 out of 1206783
    checks_failed......: 0.00%   1 out of 1206783

    ✓ 302 重定向
    ✓ Location 头存在
    ✗ 响应时间 < 100ms
      ↳  99% — ✓ 402260 / ✗ 1

    CUSTOM
    errors.........................: 0.00%  1 out of 402261
    redirect_latency...............: avg=7.21ms min=0s med=6.64ms max=114.46ms p(90)=10.57ms p(95)=12.58ms

    HTTP
    http_req_duration..............: avg=7.21ms min=0s med=6.64ms max=114.46ms p(90)=10.56ms p(95)=12.58ms
      { expected_response:true }...: avg=7.21ms min=0s med=6.64ms max=114.46ms p(90)=10.56ms p(95)=12.58ms
    http_req_failed................: 0.00%  0 out of 402281
    http_reqs......................: 402281 6689.020813/s

    EXECUTION
    iteration_duration.............: avg=7.44ms min=0s med=6.93ms max=114.46ms p(90)=10.97ms p(95)=12.99ms
    iterations.....................: 402261 6688.688258/s
    vus............................: 50     min=50          max=50
    vus_max........................: 50     min=50          max=50

    NETWORK
    data_received..................: 75 MB  1.3 MB/s
    data_sent......................: 30 MB  495 kB/s




running (1m00.1s), 00/50 VUs, 402261 complete and 0 interrupted iterations
constant_load ✓ [ 100% ] 50 VUs  1m0s
